### ISSUE TITLE
Half-Open Connections Problems

### ISSUE THREAD

**Issue by littlefrog** [nicolasff/webdis#54]
when client crash or network broken,webdis also keep the connection established for 20 hours.According TCPIP Protocal, webdis should send KeepAlive probe package to detect this,but tcpdump didn't capture this package.

webdis server tcpdump
linux-191:~/nicolasff-webdis-8a8ab84 # tcpdump -i eth0 host 10.0.64.10 and port 7379
tcpdump: verbose output suppressed, use -v or -vv for full protocol decode
listening on eth0, link-type EN10MB (Ethernet), capture size 96 bytes
09:10:30.161126 IP 10.0.64.10.40770 > linux-191.site.7379: S 272338310:272338310(0) win 5840 <mss 1460,sackOK,timestamp 167148473 0,nop,wscale 7>
09:10:30.161155 IP linux-191.site.7379 > 10.0.64.10.40770: S 652998709:652998709(0) ack 272338311 win 5792 <mss 1460,sackOK,timestamp 151672290 167148473,nop,wscale 7>
09:10:30.161495 IP 10.0.64.10.40770 > linux-191.site.7379: . ack 1 win 46 <nop,nop,timestamp 167148473 151672290>
09:10:30.200643 IP 10.0.64.10.40770 > linux-191.site.7379: P 1:257(256) ack 1 win 46 <nop,nop,timestamp 167148483 151672290>
09:10:30.200655 IP linux-191.site.7379 > 10.0.64.10.40770: . ack 257 win 54 <nop,nop,timestamp 151672300 167148483>
09:10:30.338561 IP linux-191.site.7379 > 10.0.64.10.40770: P 1:267(266) ack 257 win 54 <nop,nop,timestamp 151672334 167148483>
09:10:30.338976 IP 10.0.64.10.40770 > linux-191.site.7379: . ack 267 win 54 <nop,nop,timestamp 167148517 151672334>

11:15:30.267179 IP 10.0.64.10.40770 > linux-191.site.7379: P 257:513(256) ack 267 win 54 <nop,nop,timestamp 169023520 151672334>
11:15:30.267209 IP linux-191.site.7379 > 10.0.64.10.40770: . ack 513 win 62 <nop,nop,timestamp 153547316 169023520>
11:15:30.392543 IP linux-191.site.7379 > 10.0.64.10.40770: P 267:533(266) ack 513 win 62 <nop,nop,timestamp 153547348 169023520>
11:15:30.392908 IP 10.0.64.10.40770 > linux-191.site.7379: . ack 533 win 63 <nop,nop,timestamp 169023552 153547348>
13:20:30.363517 IP 10.0.64.10.40770 > linux-191.site.7379: P 513:769(256) ack 533 win 63 <nop,nop,timestamp 170898565 153547348>
13:20:30.363541 IP linux-191.site.7379 > 10.0.64.10.40770: . ack 769 win 71 <nop,nop,timestamp 155422340 170898565>
13:20:30.497825 IP linux-191.site.7379 > 10.0.64.10.40770: P 533:799(266) ack 769 win 71 <nop,nop,timestamp 155422374 170898565>
13:20:30.498587 IP 10.0.64.10.40770 > linux-191.site.7379: . ack 799 win 71 <nop,nop,timestamp 170898599 155422374>

at 14:00 network broken.

thanks for your help.
